id,position,country,jurisdiction,deputy,list,start,end,before,after,enwiki
Q34518124,monarch of Papua New Guinea,Q691,,,,,,,,
Q1073440,Governor-General of Papua New Guinea,Q691,,,Q29583409,1975-09-16,,,,Governor-General of Papua New Guinea
Q1074656,Prime Minister of Papua New Guinea,Q691,Q691,,,1975-09-16,,,,Prime Minister of Papua New Guinea
Q113575679,Minister of Education,Q691,Q691,,,,,,,
Q113575677,Minister of Finance,,Q691,,,,,,,
Q20716378,Minister of Foreign Affairs,Q691,Q691,,,,,,,Minister for Foreign Affairs (Papua New Guinea)
Q24188607,Minister for Foreign Affairs and Immigration,Q691,Q691,,,,,,,
Q7241305,President of the Autonomous Region of Bougainville,,Q18826,Q7925066,,2005-06-15,,,,President of the Autonomous Region of Bougainville
Q6597957,Speaker of the National Parliament of Papua New Guinea,Q691,Q691,,,1975,,,,Speaker of the National Parliament of Papua New Guinea
